{
  "schema_version": "0.2.0",
  "paper": {
    "id": "paper:li-han-jiang-gao-contrastive-identification-generation",
    "inventory_label": "#28",
    "aliases": [
      "LHJG26",
      "Paper28_ContrastiveGeneration",
      "GENLIMIT-P28"
    ],
    "title": "Contrastive Identification and Generation in the Limit",
    "authors": [
      "Xiaoyu Li",
      "Andi Han",
      "Jiaojiao Jiang",
      "Junbin Gao"
    ],
    "year": 2026,
    "citation_key": "LHJG26",
    "summary": "Develops contrastive identification and generation from crossing pairs, geometric and closure-dimension characterizations, hierarchy separations, and robustness under corrupted presentations.",
    "topics": [
      "closure-dimension",
      "contrastive-generation",
      "contrastive-identification",
      "corrupted-presentation",
      "defect-number"
    ],
    "paper_map": "GenLimitLean/PaperMaps/Paper28_ContrastiveGeneration.md",
    "umbrella_module": "GenLimit.Paper28_ContrastiveGeneration",
    "declaration_namespaces": [
      "GenLimit.ContrastiveGeneration"
    ],
    "formalization_scope": {
      "coverage": "unknown",
      "summary": "Claim-level and Lean-declaration inventories have not started, so this identity card does not assert aggregate formalization coverage.",
      "specializations": [],
      "gaps": []
    },
    "audit_refs": [
      {
        "kind": "ai-statement-faithfulness",
        "path": "GenLimitLean/AuditRecords/Paper28_ContrastiveGeneration/record.json",
        "scope": "Machine-readable source provenance, correspondence, and repair chronology for arXiv v1; this identity card does not convert that evidence into claim-level coverage."
      },
      {
        "kind": "kernel-audit",
        "path": "GenLimitLean/Audit.lean",
        "scope": "Project-wide axiom checks include selected P28 paper-facing declarations; this is not a complete declaration inventory or a source-correspondence audit."
      }
    ]
  },
  "source_editions": [
    {
      "id": "arxiv-2605-06211-v1",
      "kind": "arxiv",
      "label": "arXiv:2605.06211v1",
      "identifier": "arXiv:2605.06211v1",
      "url": "https://arxiv.org/abs/2605.06211v1",
      "version_date": "2026-05-07",
      "pdf_sha256": "40af9564b2066c0c47840aaf66b28caf12e5848b1673153cfcd4c92d0de5bf2a",
      "relations": []
    }
  ],
  "claim_inventory": [
    {
      "source_edition": "arxiv-2605-06211-v1",
      "scope": "all-numbered-results",
      "scope_description": "All numbered results in arXiv v1; source-claim inventory work has not started.",
      "completeness": "not-started",
      "exclusions": [],
      "notes": "No source claim is registered yet, so absence from this identity card has no mathematical or formalization-status meaning."
    }
  ],
  "lean_declaration_inventory": {
    "scope": "paper-facing",
    "scope_description": "Paper-facing Lean declarations reachable from this paper's umbrella module have not yet been inventoried for claim correspondence.",
    "completeness": "not-started",
    "exclusions": [],
    "notes": "Identity card only; declaration presence in the Lean library is not yet represented by claim links."
  },
  "claims": []
}
