{
  "schema_version": "0.2.0",
  "paper": {
    "id": "paper:kleinberg-mehrotra-saberi-velegkas-bounded-memory",
    "inventory_label": "#31",
    "aliases": [
      "KMSV26",
      "Paper31_BoundedMemory",
      "GENLIMIT-P31"
    ],
    "title": "On Language Generation in the Limit with Bounded Memory",
    "authors": [
      "Jon Kleinberg",
      "Anay Mehrotra",
      "Amin Saberi",
      "Grigoris Velegkas"
    ],
    "year": 2026,
    "citation_key": "KMSV26",
    "summary": "Studies language generation and identification with memoryless, sliding-window, adaptive-buffer, and incremental memory restrictions, including density guarantees and impossibility results.",
    "topics": [
      "adaptive-buffer",
      "bounded-memory",
      "incremental-identification",
      "memoryless-generation",
      "ordered-density",
      "sliding-window"
    ],
    "paper_map": "GenLimitLean/PaperMaps/Paper31_BoundedMemory.md",
    "umbrella_module": "GenLimit.Paper31_BoundedMemory",
    "declaration_namespaces": [
      "GenLimit.BoundedMemory"
    ],
    "formalization_scope": {
      "coverage": "unknown",
      "summary": "Claim-level and Lean-declaration inventories have not started, so this identity card does not assert aggregate formalization coverage.",
      "specializations": [],
      "gaps": []
    },
    "audit_refs": [
      {
        "kind": "ai-statement-faithfulness",
        "path": "GenLimitLean/AuditRecords/Paper31_BoundedMemory/record.json",
        "scope": "Machine-readable source provenance, correspondence, and repair chronology for arXiv v1; this identity card does not convert that evidence into claim-level coverage."
      },
      {
        "kind": "kernel-audit",
        "path": "GenLimitLean/Audit.lean",
        "scope": "Project-wide axiom checks include selected P31 paper-facing declarations; this is not a complete declaration inventory or a source-correspondence audit."
      }
    ]
  },
  "source_editions": [
    {
      "id": "arxiv-2605-30324-v1",
      "kind": "arxiv",
      "label": "arXiv:2605.30324v1",
      "identifier": "arXiv:2605.30324v1",
      "url": "https://arxiv.org/abs/2605.30324v1",
      "version_date": "2026-05-28",
      "pdf_sha256": "6c446edfa4f8ebc2978d144d213e88f61f29d06922721b016ba89faf64470049",
      "relations": []
    }
  ],
  "claim_inventory": [
    {
      "source_edition": "arxiv-2605-30324-v1",
      "scope": "all-numbered-results",
      "scope_description": "All numbered results in arXiv v1; source-claim inventory work has not started.",
      "completeness": "not-started",
      "exclusions": [],
      "notes": "No source claim is registered yet, so absence from this identity card has no mathematical or formalization-status meaning."
    }
  ],
  "lean_declaration_inventory": {
    "scope": "paper-facing",
    "scope_description": "Paper-facing Lean declarations reachable from this paper's umbrella module have not yet been inventoried for claim correspondence.",
    "completeness": "not-started",
    "exclusions": [],
    "notes": "Identity card only; declaration presence in the Lean library is not yet represented by claim links."
  },
  "claims": []
}
